ECS_Version,Indexed,Field_Set,Field,Type,Level,Normalization,Example,Description,Id
9.1.0-dev,TRUE,gen_ai,gen_ai.agent.name,keyword,extended,,Math Tutor; Fiction Writer,Human-readable name of the GenAI agent provided by the application.,field0422
9.1.0-dev,TRUE,gen_ai,gen_ai.operation.name,keyword,extended,,chat; text_completion; embeddings,The name of the operation being performed.,field0423
9.1.0-dev,TRUE,gen_ai,gen_ai.output.type,keyword,extended,,text; json; image,Represents the content type requested by the client.,field0424
9.1.0-dev,TRUE,gen_ai,gen_ai.request.choice.count,integer,extended,,3,The target number of candidate completions to return.,field0425
9.1.0-dev,TRUE,gen_ai,gen_ai.request.encoding_formats,nested,extended,,"[""float"", ""binary""]","The encoding formats requested in an embeddings operation, if specified.",field0426
9.1.0-dev,TRUE,gen_ai,gen_ai.request.frequency_penalty,double,extended,,0.1,The frequency penalty setting for the GenAI request.,field0427
9.1.0-dev,TRUE,gen_ai,gen_ai.request.max_tokens,integer,extended,,100,The maximum number of tokens the model generates for a request.,field0428
9.1.0-dev,TRUE,gen_ai,gen_ai.request.model,keyword,extended,,gpt-4,The name of the GenAI model a request is being made to.,field0429
9.1.0-dev,TRUE,gen_ai,gen_ai.request.presence_penalty,double,extended,,0.1,The presence penalty setting for the GenAI request.,field0430
9.1.0-dev,TRUE,gen_ai,gen_ai.request.seed,integer,extended,,100,Requests with same seed value more likely to return same result.,field0431
9.1.0-dev,TRUE,gen_ai,gen_ai.request.stop_sequences,nested,extended,,"[""forest"", ""lived""]",List of sequences that the model will use to stop generating further tokens.,field0432
9.1.0-dev,TRUE,gen_ai,gen_ai.request.temperature,double,extended,,0,The temperature setting for the GenAI request.,field0433
9.1.0-dev,TRUE,gen_ai,gen_ai.request.top_k,double,extended,,1,The top_k sampling setting for the GenAI request.,field0434
9.1.0-dev,TRUE,gen_ai,gen_ai.request.top_p,double,extended,,1,The top_p sampling setting for the GenAI request.,field0435
9.1.0-dev,TRUE,gen_ai,gen_ai.response.finish_reasons,nested,extended,,"[""stop"", ""length""]","Array of reasons the model stopped generating tokens, corresponding to each generation received.",field0436
9.1.0-dev,TRUE,gen_ai,gen_ai.response.id,keyword,extended,,chatcmpl-123,The unique identifier for the completion.,field0437
9.1.0-dev,TRUE,gen_ai,gen_ai.response.model,keyword,extended,,gpt-4-0613,The name of the model that generated the response.,field0438
9.1.0-dev,TRUE,gen_ai,gen_ai.system,keyword,extended,,openai,The Generative AI product as identified by the client or server instrumentation.,field0439
9.1.0-dev,TRUE,gen_ai,gen_ai.token.type,keyword,extended,,input; output,The type of token being counted.,field0440
9.1.0-dev,TRUE,gen_ai,gen_ai.tool.call.id,keyword,extended,,call_mszuSIzqtI65i1wAUOE8w5H4,The tool call identifier.,field0441
9.1.0-dev,TRUE,gen_ai,gen_ai.tool.name,keyword,extended,,Flights,Name of the tool utilized by the agent.,field0442
9.1.0-dev,TRUE,gen_ai,gen_ai.tool.type,keyword,extended,,function; extension; datastore,Type of the tool utilized by the agent,field0443
9.1.0-dev,TRUE,gen_ai,gen_ai.usage.input_tokens,integer,extended,,100,The number of tokens used in the GenAI input (prompt).,field0444
9.1.0-dev,TRUE,gen_ai,gen_ai.usage.output_tokens,integer,extended,,180,The number of tokens used in the GenAI response (completion).,field0445
9.1.0-dev,TRUE,group,group.domain,keyword,extended,,,Name of the directory the group is a member of.,field0446
9.1.0-dev,TRUE,group,group.id,keyword,extended,,,Unique identifier for the group on the system/platform.,field0447
9.1.0-dev,TRUE,group,group.name,keyword,extended,,,Name of the group.,field0448
9.1.0-dev,TRUE,host,host.architecture,keyword,core,,x86_64,Operating system architecture.,field0449
9.1.0-dev,TRUE,host,host.boot.id,keyword,extended,,88a1f0ed-5ae5-41ee-af6b-41921c311872,Linux boot uuid taken from /proc/sys/kernel/random/boot_id,field0450
9.1.0-dev,TRUE,host,host.cpu.usage,scaled_float,extended,,,"Percent CPU used, between 0 and 1.",field0451
9.1.0-dev,TRUE,host,host.disk.read.bytes,long,extended,,,The number of bytes read by all disks.,field0452
9.1.0-dev,TRUE,host,host.disk.write.bytes,long,extended,,,The number of bytes written on all disks.,field0453
9.1.0-dev,TRUE,host,host.domain,keyword,extended,,CONTOSO,Name of the directory the group is a member of.,field0454
9.1.0-dev,TRUE,host,host.geo.city_name,keyword,core,,Montreal,City name.,field0455
9.1.0-dev,TRUE,host,host.geo.continent_code,keyword,core,,NA,Continent code.,field0456
9.1.0-dev,TRUE,host,host.geo.continent_name,keyword,core,,North America,Name of the continent.,field0457
9.1.0-dev,TRUE,host,host.geo.country_iso_code,keyword,core,,CA,Country ISO code.,field0458
9.1.0-dev,TRUE,host,host.geo.country_name,keyword,core,,Canada,Country name.,field0459
9.1.0-dev,TRUE,host,host.geo.location,geo_point,core,,"{ ""lon"": -73.614830, ""lat"": 45.505918 }",Longitude and latitude.,field0460
9.1.0-dev,TRUE,host,host.geo.name,keyword,extended,,boston-dc,User-defined description of a location.,field0461
9.1.0-dev,TRUE,host,host.geo.postal_code,keyword,core,,94040,Postal code.,field0462
9.1.0-dev,TRUE,host,host.geo.region_iso_code,keyword,core,,CA-QC,Region ISO code.,field0463
9.1.0-dev,TRUE,host,host.geo.region_name,keyword,core,,Quebec,Region name.,field0464
9.1.0-dev,TRUE,host,host.geo.timezone,keyword,core,,America/Argentina/Buenos_Aires,Time zone.,field0465
9.1.0-dev,TRUE,host,host.hostname,keyword,core,,,Hostname of the host.,field0466
9.1.0-dev,TRUE,host,host.id,keyword,core,,,Unique host id.,field0467
9.1.0-dev,TRUE,host,host.ip,ip,core,array,,Host ip addresses.,field0468
9.1.0-dev,TRUE,host,host.mac,keyword,core,array,"[""00-00-5E-00-53-23"", ""00-00-5E-00-53-24""]",Host MAC addresses.,field0469
9.1.0-dev,TRUE,host,host.name,keyword,core,,,Name of the host.,field0470
9.1.0-dev,TRUE,host,host.network.egress.bytes,long,extended,,,The number of bytes sent on all network interfaces.,field0471
9.1.0-dev,TRUE,host,host.network.egress.packets,long,extended,,,The number of packets sent on all network interfaces.,field0472
9.1.0-dev,TRUE,host,host.network.ingress.bytes,long,extended,,,The number of bytes received on all network interfaces.,field0473
9.1.0-dev,TRUE,host,host.network.ingress.packets,long,extended,,,The number of packets received on all network interfaces.,field0474
9.1.0-dev,TRUE,host,host.os.family,keyword,extended,,debian,"OS family (such as redhat, debian, freebsd, windows).",field0475
9.1.0-dev,TRUE,host,host.os.full,keyword,extended,,Mac OS Mojave,"Operating system name, including the version or code name.",field0476
9.1.0-dev,TRUE,host,host.os.full.text,match_only_text,extended,,Mac OS Mojave,"Operating system name, including the version or code name.",field0477
9.1.0-dev,TRUE,host,host.os.kernel,keyword,extended,,4.4.0-112-generic,Operating system kernel version as a raw string.,field0478
9.1.0-dev,TRUE,host,host.os.name,keyword,extended,,Mac OS X,"Operating system name, without the version.",field0479
9.1.0-dev,TRUE,host,host.os.name.text,match_only_text,extended,,Mac OS X,"Operating system name, without the version.",field0480
9.1.0-dev,TRUE,host,host.os.platform,keyword,extended,,darwin,"Operating system platform (such centos, ubuntu, windows).",field0481
9.1.0-dev,TRUE,host,host.os.type,keyword,extended,,macos,"Which commercial OS family (one of: linux, macos, unix, windows, ios or android).",field0482
9.1.0-dev,TRUE,host,host.os.version,keyword,extended,,10.14.1,Operating system version as a raw string.,field0483
9.1.0-dev,TRUE,host,host.pid_ns_ino,keyword,extended,,256383,Pid namespace inode,field0484
9.1.0-dev,TRUE,host,host.risk.calculated_level,keyword,extended,,High,A risk classification level calculated by an internal system as part of entity analytics and entity risk scoring.,field0485
9.1.0-dev,TRUE,host,host.risk.calculated_score,float,extended,,880.73,A risk classification score calculated by an internal system as part of entity analytics and entity risk scoring.,field0486
9.1.0-dev,TRUE,host,host.risk.calculated_score_norm,float,extended,,88.73,A normalized risk score calculated by an internal system.,field0487
9.1.0-dev,TRUE,host,host.risk.static_level,keyword,extended,,High,"A risk classification level obtained from outside the system, such as from some external Threat Intelligence Platform.",field0488
9.1.0-dev,TRUE,host,host.risk.static_score,float,extended,,830,"A risk classification score obtained from outside the system, such as from some external Threat Intelligence Platform.",field0489
9.1.0-dev,TRUE,host,host.risk.static_score_norm,float,extended,,83,A normalized risk score calculated by an external system.,field0490
9.1.0-dev,TRUE,host,host.type,keyword,core,,,Type of host.,field0491
9.1.0-dev,TRUE,host,host.uptime,long,extended,,1325,Seconds the host has been up.,field0492
9.1.0-dev,TRUE,http,http.request.body.bytes,long,extended,,887,Size in bytes of the request body.,field0493
9.1.0-dev,TRUE,http,http.request.body.content,wildcard,extended,,Hello world,The full HTTP request body.,field0494
9.1.0-dev,TRUE,http,http.request.body.content.text,match_only_text,extended,,Hello world,The full HTTP request body.,field0495
9.1.0-dev,TRUE,http,http.request.bytes,long,extended,,1437,Total size in bytes of the request (body and headers).,field0496
9.1.0-dev,TRUE,http,http.request.id,keyword,extended,,123e4567-e89b-12d3-a456-426614174000,HTTP request ID.,field0497
9.1.0-dev,TRUE,http,http.request.method,keyword,extended,,POST,HTTP request method.,field0498
9.1.0-dev,TRUE,http,http.request.mime_type,keyword,extended,,image/gif,Mime type of the body of the request.,field0499
9.1.0-dev,TRUE,http,http.request.referrer,keyword,extended,,https://blog.example.com/,Referrer for this HTTP request.,field0500
9.1.0-dev,TRUE,http,http.response.body.bytes,long,extended,,887,Size in bytes of the response body.,field0501
9.1.0-dev,TRUE,http,http.response.body.content,wildcard,extended,,Hello world,The full HTTP response body.,field0502
9.1.0-dev,TRUE,http,http.response.body.content.text,match_only_text,extended,,Hello world,The full HTTP response body.,field0503
9.1.0-dev,TRUE,http,http.response.bytes,long,extended,,1437,Total size in bytes of the response (body and headers).,field0504
9.1.0-dev,TRUE,http,http.response.mime_type,keyword,extended,,image/gif,Mime type of the body of the response.,field0505
9.1.0-dev,TRUE,http,http.response.status_code,long,extended,,404,HTTP response status code.,field0506
9.1.0-dev,TRUE,http,http.version,keyword,extended,,1.1,HTTP version.,field0507
9.1.0-dev,TRUE,log,log.file.path,keyword,extended,,/var/log/fun-times.log,Full path to the log file this event came from.,field0508
9.1.0-dev,TRUE,log,log.level,keyword,core,,error,Log level of the log event.,field0509
9.1.0-dev,TRUE,log,log.logger,keyword,core,,org.elasticsearch.bootstrap.Bootstrap,Name of the logger.,field0510
9.1.0-dev,TRUE,log,log.origin.file.line,long,extended,,42,The line number of the file which originated the log event.,field0511
9.1.0-dev,TRUE,log,log.origin.file.name,keyword,extended,,Bootstrap.java,The code file which originated the log event.,field0512
9.1.0-dev,TRUE,log,log.origin.function,keyword,extended,,init,The function which originated the log event.,field0513
9.1.0-dev,TRUE,log,log.syslog,object,extended,,,Syslog metadata,field0514
9.1.0-dev,TRUE,log,log.syslog.appname,keyword,extended,,sshd,The device or application that originated the Syslog message.,field0515
9.1.0-dev,TRUE,log,log.syslog.facility.code,long,extended,,23,Syslog numeric facility of the event.,field0516
9.1.0-dev,TRUE,log,log.syslog.facility.name,keyword,extended,,local7,Syslog text-based facility of the event.,field0517
9.1.0-dev,TRUE,log,log.syslog.hostname,keyword,extended,,example-host,The host that originated the Syslog message.,field0518
9.1.0-dev,TRUE,log,log.syslog.msgid,keyword,extended,,ID47,An identifier for the type of Syslog message.,field0519
9.1.0-dev,TRUE,log,log.syslog.priority,long,extended,,135,Syslog priority of the event.,field0520
9.1.0-dev,TRUE,log,log.syslog.procid,keyword,extended,,12345,The process name or ID that originated the Syslog message.,field0521
9.1.0-dev,TRUE,log,log.syslog.severity.code,long,extended,,3,Syslog numeric severity of the event.,field0522
9.1.0-dev,TRUE,log,log.syslog.severity.name,keyword,extended,,Error,Syslog text-based severity of the event.,field0523
9.1.0-dev,TRUE,log,log.syslog.structured_data,flattened,extended,,,Structured data expressed in RFC 5424 messages.,field0524
9.1.0-dev,TRUE,log,log.syslog.version,keyword,extended,,1,Syslog protocol version.,field0525
9.1.0-dev,TRUE,network,network.application,keyword,extended,,aim,Application level protocol name.,field0526
9.1.0-dev,TRUE,network,network.bytes,long,core,,368,Total bytes transferred in both directions.,field0527
9.1.0-dev,TRUE,network,network.community_id,keyword,extended,,1:hO+sN4H+MG5MY/8hIrXPqc4ZQz0=,A hash of source and destination IPs and ports.,field0528
9.1.0-dev,TRUE,network,network.direction,keyword,core,,inbound,Direction of the network traffic.,field0529
9.1.0-dev,TRUE,network,network.forwarded_ip,ip,core,,192.1.1.2,Host IP address when the source IP address is the proxy.,field0530
9.1.0-dev,TRUE,network,network.iana_number,keyword,extended,,6,IANA Protocol Number.,field0531
9.1.0-dev,TRUE,network,network.inner,object,extended,,,Inner VLAN tag information,field0532
9.1.0-dev,TRUE,network,network.inner.vlan.id,keyword,extended,,10,VLAN ID as reported by the observer.,field0533
9.1.0-dev,TRUE,network,network.inner.vlan.name,keyword,extended,,outside,Optional VLAN name as reported by the observer.,field0534
9.1.0-dev,TRUE,network,network.name,keyword,extended,,Guest Wifi,Name given by operators to sections of their network.,field0535
9.1.0-dev,TRUE,network,network.packets,long,core,,24,Total packets transferred in both directions.,field0536
9.1.0-dev,TRUE,network,network.protocol,keyword,core,,http,Application protocol name.,field0537
9.1.0-dev,TRUE,network,network.transport,keyword,core,,tcp,Protocol Name corresponding to the field `iana_number`.,field0538
9.1.0-dev,TRUE,network,network.type,keyword,core,,ipv4,"In the OSI Model this would be the Network Layer. ipv4, ipv6, ipsec, pim, etc",field0539
9.1.0-dev,TRUE,network,network.vlan.id,keyword,extended,,10,VLAN ID as reported by the observer.,field0540
9.1.0-dev,TRUE,network,network.vlan.name,keyword,extended,,outside,Optional VLAN name as reported by the observer.,field0541
9.1.0-dev,TRUE,observer,observer.egress,object,extended,,,Object field for egress information,field0542
9.1.0-dev,TRUE,observer,observer.egress.interface.alias,keyword,extended,,outside,Interface alias,field0543
9.1.0-dev,TRUE,observer,observer.egress.interface.id,keyword,extended,,10,Interface ID,field0544
9.1.0-dev,TRUE,observer,observer.egress.interface.name,keyword,extended,,eth0,Interface name,field0545
9.1.0-dev,TRUE,observer,observer.egress.vlan.id,keyword,extended,,10,VLAN ID as reported by the observer.,field0546
9.1.0-dev,TRUE,observer,observer.egress.vlan.name,keyword,extended,,outside,Optional VLAN name as reported by the observer.,field0547
9.1.0-dev,TRUE,observer,observer.egress.zone,keyword,extended,,Public_Internet,Observer Egress zone,field0548
9.1.0-dev,TRUE,observer,observer.geo.city_name,keyword,core,,Montreal,City name.,field0549
9.1.0-dev,TRUE,observer,observer.geo.continent_code,keyword,core,,NA,Continent code.,field0550
9.1.0-dev,TRUE,observer,observer.geo.continent_name,keyword,core,,North America,Name of the continent.,field0551
9.1.0-dev,TRUE,observer,observer.geo.country_iso_code,keyword,core,,CA,Country ISO code.,field0552
9.1.0-dev,TRUE,observer,observer.geo.country_name,keyword,core,,Canada,Country name.,field0553
9.1.0-dev,TRUE,observer,observer.geo.location,geo_point,core,,"{ ""lon"": -73.614830, ""lat"": 45.505918 }",Longitude and latitude.,field0554
9.1.0-dev,TRUE,observer,observer.geo.name,keyword,extended,,boston-dc,User-defined description of a location.,field0555
9.1.0-dev,TRUE,observer,observer.geo.postal_code,keyword,core,,94040,Postal code.,field0556
9.1.0-dev,TRUE,observer,observer.geo.region_iso_code,keyword,core,,CA-QC,Region ISO code.,field0557
9.1.0-dev,TRUE,observer,observer.geo.region_name,keyword,core,,Quebec,Region name.,field0558
9.1.0-dev,TRUE,observer,observer.geo.timezone,keyword,core,,America/Argentina/Buenos_Aires,Time zone.,field0559
9.1.0-dev,TRUE,observer,observer.hostname,keyword,core,,,Hostname of the observer.,field0560
9.1.0-dev,TRUE,observer,observer.ingress,object,extended,,,Object field for ingress information,field0561
9.1.0-dev,TRUE,observer,observer.ingress.interface.alias,keyword,extended,,outside,Interface alias,field0562
9.1.0-dev,TRUE,observer,observer.ingress.interface.id,keyword,extended,,10,Interface ID,field0563
9.1.0-dev,TRUE,observer,observer.ingress.interface.name,keyword,extended,,eth0,Interface name,field0564
9.1.0-dev,TRUE,observer,observer.ingress.vlan.id,keyword,extended,,10,VLAN ID as reported by the observer.,field0565
9.1.0-dev,TRUE,observer,observer.ingress.vlan.name,keyword,extended,,outside,Optional VLAN name as reported by the observer.,field0566
9.1.0-dev,TRUE,observer,observer.ingress.zone,keyword,extended,,DMZ,Observer ingress zone,field0567
9.1.0-dev,TRUE,observer,observer.ip,ip,core,array,,IP addresses of the observer.,field0568
9.1.0-dev,TRUE,observer,observer.mac,keyword,core,array,"[""00-00-5E-00-53-23"", ""00-00-5E-00-53-24""]",MAC addresses of the observer.,field0569
9.1.0-dev,TRUE,observer,observer.name,keyword,extended,,1_proxySG,Custom name of the observer.,field0570
9.1.0-dev,TRUE,observer,observer.os.family,keyword,extended,,debian,"OS family (such as redhat, debian, freebsd, windows).",field0571
9.1.0-dev,TRUE,observer,observer.os.full,keyword,extended,,Mac OS Mojave,"Operating system name, including the version or code name.",field0572
9.1.0-dev,TRUE,observer,observer.os.full.text,match_only_text,extended,,Mac OS Mojave,"Operating system name, including the version or code name.",field0573
9.1.0-dev,TRUE,observer,observer.os.kernel,keyword,extended,,4.4.0-112-generic,Operating system kernel version as a raw string.,field0574
9.1.0-dev,TRUE,observer,observer.os.name,keyword,extended,,Mac OS X,"Operating system name, without the version.",field0575
9.1.0-dev,TRUE,observer,observer.os.name.text,match_only_text,extended,,Mac OS X,"Operating system name, without the version.",field0576
9.1.0-dev,TRUE,observer,observer.os.platform,keyword,extended,,darwin,"Operating system platform (such centos, ubuntu, windows).",field0577
9.1.0-dev,TRUE,observer,observer.os.type,keyword,extended,,macos,"Which commercial OS family (one of: linux, macos, unix, windows, ios or android).",field0578
9.1.0-dev,TRUE,observer,observer.os.version,keyword,extended,,10.14.1,Operating system version as a raw string.,field0579
9.1.0-dev,TRUE,observer,observer.product,keyword,extended,,s200,The product name of the observer.,field0580
9.1.0-dev,TRUE,observer,observer.serial_number,keyword,extended,,,Observer serial number.,field0581
9.1.0-dev,TRUE,observer,observer.type,keyword,core,,firewall,The type of the observer the data is coming from.,field0582
9.1.0-dev,TRUE,observer,observer.vendor,keyword,core,,Symantec,Vendor name of the observer.,field0583
9.1.0-dev,TRUE,observer,observer.version,keyword,core,,,Observer version.,field0584
9.1.0-dev,TRUE,orchestrator,orchestrator.api_version,keyword,extended,,v1beta1,API version being used to carry out the action,field0585
9.1.0-dev,TRUE,orchestrator,orchestrator.cluster.id,keyword,extended,,,Unique ID of the cluster.,field0586
9.1.0-dev,TRUE,orchestrator,orchestrator.cluster.name,keyword,extended,,,Name of the cluster.,field0587
9.1.0-dev,TRUE,orchestrator,orchestrator.cluster.url,keyword,extended,,,URL of the API used to manage the cluster.,field0588
9.1.0-dev,TRUE,orchestrator,orchestrator.cluster.version,keyword,extended,,,The version of the cluster.,field0589
9.1.0-dev,TRUE,orchestrator,orchestrator.namespace,keyword,extended,,kube-system,Namespace in which the action is taking place.,field0590
9.1.0-dev,TRUE,orchestrator,orchestrator.organization,keyword,extended,,elastic,Organization affected by the event (for multi-tenant orchestrator setups).,field0591
9.1.0-dev,TRUE,orchestrator,orchestrator.resource.annotation,keyword,extended,array,"['key1:value1', 'key2:value2', 'key3:value3']",The list of annotations added to the resource.,field0592
9.1.0-dev,TRUE,orchestrator,orchestrator.resource.id,keyword,extended,,,Unique ID of the resource being acted upon.,field0593
9.1.0-dev,TRUE,orchestrator,orchestrator.resource.ip,ip,extended,array,,IP address assigned to the resource associated with the event being observed.,field0594
9.1.0-dev,TRUE,orchestrator,orchestrator.resource.label,keyword,extended,array,"['key1:value1', 'key2:value2', 'key3:value3']",The list of labels added to the resource.,field0595
9.1.0-dev,TRUE,orchestrator,orchestrator.resource.name,keyword,extended,,test-pod-cdcws,Name of the resource being acted upon.,field0596
9.1.0-dev,TRUE,orchestrator,orchestrator.resource.parent.type,keyword,extended,,DaemonSet,Type or kind of the parent resource associated with the event being observed.,field0597
9.1.0-dev,TRUE,orchestrator,orchestrator.resource.type,keyword,extended,,service,Type of resource being acted upon.,field0598
9.1.0-dev,TRUE,orchestrator,orchestrator.type,keyword,extended,,kubernetes,"Orchestrator cluster type (e.g. kubernetes, nomad or cloudfoundry).",field0599
9.1.0-dev,TRUE,organization,organization.id,keyword,extended,,,Unique identifier for the organization.,field0600
9.1.0-dev,TRUE,organization,organization.name,keyword,extended,,,Organization name.,field0601
9.1.0-dev,TRUE,organization,organization.name.text,match_only_text,extended,,,Organization name.,field0602
9.1.0-dev,TRUE,package,package.architecture,keyword,extended,,x86_64,Package architecture.,field0603
9.1.0-dev,TRUE,package,package.build_version,keyword,extended,,36f4f7e89dd61b0988b12ee000b98966867710cd,Build version information,field0604
9.1.0-dev,TRUE,package,package.checksum,keyword,extended,,68b329da9893e34099c7d8ad5cb9c940,Checksum of the installed package for verification.,field0605
9.1.0-dev,TRUE,package,package.description,keyword,extended,,Open source programming language to build simple/reliable/efficient software.,Description of the package.,field0606
9.1.0-dev,TRUE,package,package.install_scope,keyword,extended,,global,"Indicating how the package was installed, e.g. user-local, global.",field0607
9.1.0-dev,TRUE,package,package.installed,date,extended,,,Time when package was installed.,field0608
9.1.0-dev,TRUE,package,package.license,keyword,extended,,Apache License 2.0,Package license,field0609
9.1.0-dev,TRUE,package,package.name,keyword,extended,,go,Package name,field0610
9.1.0-dev,TRUE,package,package.path,keyword,extended,,/usr/local/Cellar/go/1.12.9/,Path where the package is installed.,field0611
9.1.0-dev,TRUE,package,package.reference,keyword,extended,,https://golang.org,Package home page or reference URL,field0612
9.1.0-dev,TRUE,package,package.size,long,extended,,62231,Package size in bytes.,field0613
9.1.0-dev,TRUE,package,package.type,keyword,extended,,rpm,Package type,field0614
9.1.0-dev,TRUE,package,package.version,keyword,extended,,1.12.9,Package version,field0615
9.1.0-dev,TRUE,process,process.args,keyword,extended,array,"[""/usr/bin/ssh"", ""-l"", ""user"", ""10.0.0.16""]",Array of process arguments.,field0616
9.1.0-dev,TRUE,process,process.args_count,long,extended,,4,Length of the process.args array.,field0617
9.1.0-dev,TRUE,process,process.code_signature.digest_algorithm,keyword,extended,,sha256,Hashing algorithm used to sign the process.,field0618
9.1.0-dev,TRUE,process,process.code_signature.exists,boolean,core,,TRUE,Boolean to capture if a signature is present.,field0619
9.1.0-dev,TRUE,process,process.code_signature.flags,keyword,extended,,570522385,Code signing flags of the process,field0620
9.1.0-dev,TRUE,process,process.code_signature.signing_id,keyword,extended,,com.apple.xpc.proxy,The identifier used to sign the process.,field0621
9.1.0-dev,TRUE,process,process.code_signature.status,keyword,extended,,ERROR_UNTRUSTED_ROOT,Additional information about the certificate status.,field0622
9.1.0-dev,TRUE,process,process.code_signature.subject_name,keyword,core,,Microsoft Corporation,Subject name of the code signer,field0623
9.1.0-dev,TRUE,process,process.code_signature.team_id,keyword,extended,,EQHXZ8M8AV,The team identifier used to sign the process.,field0624
9.1.0-dev,TRUE,process,process.code_signature.thumbprint_sha256,keyword,extended,,c0f23a8eb1cba0ccaa88483b5a234c96e4bdfec719bf458024e68c2a8183476b,SHA256 hash of the certificate.,field0625
9.1.0-dev,TRUE,process,process.code_signature.timestamp,date,extended,,2021-01-01T12:10:30Z,When the signature was generated and signed.,field0626
9.1.0-dev,TRUE,process,process.code_signature.trusted,boolean,extended,,TRUE,Stores the trust status of the certificate chain.,field0627
9.1.0-dev,TRUE,process,process.code_signature.valid,boolean,extended,,TRUE,Boolean to capture if the digital signature is verified against the binary content.,field0628
9.1.0-dev,TRUE,process,process.command_line,wildcard,extended,,/usr/bin/ssh -l user 10.0.0.16,Full command line that started the process.,field0629
9.1.0-dev,TRUE,process,process.command_line.text,match_only_text,extended,,/usr/bin/ssh -l user 10.0.0.16,Full command line that started the process.,field0630
9.1.0-dev,TRUE,process,process.elf.architecture,keyword,extended,,x86-64,Machine architecture of the ELF file.,field0631
9.1.0-dev,TRUE,process,process.elf.byte_order,keyword,extended,,Little Endian,Byte sequence of ELF file.,field0632
9.1.0-dev,TRUE,process,process.elf.cpu_type,keyword,extended,,Intel,CPU type of the ELF file.,field0633
